{
  "schemaVersion": 1,
  "manifestId": "adept-ui-v1.0-provider-manifest",
  "displayName": "Adept UI v1.0 Provider Manifest (frozen)",
  "status": "frozen",
  "freezeNote": "Frozen 2026-07-26 on branch phase2/codirector-m2-9-production-suite from real project state. Derived from native baseline sha256=630069ff4abe79348f5632236f12796da03e6e79cbb6209198f636f29ac42b57 and native snapshot sha256=7c37d8fb8aac551d29bb7909cc0d1812c99b97d7083aca1e88e3e1e72aa09ca7. Tip at freeze authoring recorded in frozenFromTip. Does not invent generative audio providers for deferred gaps. Does not authorize sandbox install or M2.10b.",
  "source": "native_project_state",
  "derivedFrom": [
    "config/capabilities/adept-ui-v1.0-native.json",
    "config/capabilities/adept-ui-v1.0-native-snapshot.json",
    "studio-api/app/capabilities/registry.py",
    "studio-api/app/workflows/registry.py",
    "studio-api/app/providers/contracts.py",
    "studio-api/app/adapters/comfy.py",
    "studio-api/app/adapters/ffmpeg.py",
    "studio-api/app/codirector/m29/providers.py"
  ],
  "frozenAt": "2026-07-26",
  "frozenOnBranch": "phase2/codirector-m2-9-production-suite",
  "frozenFromTip": "2c5d326bf510e38534e1075da5883f9d4ec05941",
  "nativeBaselineSha256": "630069ff4abe79348f5632236f12796da03e6e79cbb6209198f636f29ac42b57",
  "nativeSnapshotSha256": "7c37d8fb8aac551d29bb7909cc0d1812c99b97d7083aca1e88e3e1e72aa09ca7",
  "milestoneContext": {
    "m271": "Accepted",
    "m28": "Accepted (criteria not weakened)",
    "m29": "Accepted with documented native capability limitations",
    "m210": "M2.10.1 authorized — provider manifest freeze + discovery/qualification (no install)",
    "m210b": "BLOCKED until Product-approved sandbox shortlist",
    "m30": "Not started"
  },
  "providerKinds": {
    "builtInLocal": [
      "comfy.local",
      "vision.local"
    ],
    "externalApiApprovedOptional": [
      "fal.api"
    ],
    "deterministicProcessor": [],
    "addon": []
  },
  "providers": [
    {
      "providerId": "comfy.local",
      "displayName": "Local ComfyUI",
      "kind": "comfy",
      "kindDetail": "native_local_comfy",
      "sourceBucket": "builtInLocal",
      "status": "registered",
      "runtimeEvidence": [
        "config/capabilities/adept-ui-v1.0-native.json#providerKinds.builtInLocal",
        "studio-api/app/adapters/comfy.py",
        "studio-api/app/workflows/registry.py"
      ],
      "capabilityIdsBound": [
        "generation.image.queue",
        "generation.lipsync.queue",
        "generation.video.queue",
        "storyboard.generate"
      ],
      "workflowAdapterIds": [
        "ltx.scene",
        "ltx.simple_i2v",
        "ltx.ingredients_ic_lora",
        "wan.first_last_frame",
        "lipsync.latentsync",
        "image.txt2img",
        "image.img2img_edit",
        "image.zimage_reference"
      ],
      "jobHandlerIds": [],
      "licenseSummary": "runtime_environment_local",
      "notes": "Primary native local generation backend for image/video/lipsync workflows."
    },
    {
      "providerId": "vision.local",
      "displayName": "Local Vision Validator (M2.5)",
      "kind": "validator",
      "kindDetail": "native_local_validator",
      "sourceBucket": "builtInLocal",
      "status": "registered",
      "runtimeEvidence": [
        "config/capabilities/adept-ui-v1.0-native.json#providerKinds.builtInLocal",
        "studio-api/app/codirector/vision/providers/"
      ],
      "capabilityIdsBound": [
        "codirector.vision.validate"
      ],
      "workflowAdapterIds": [],
      "jobHandlerIds": [
        "validate"
      ],
      "licenseSummary": "runtime_environment_local",
      "notes": "M2.5 VisionEngine local validator provider."
    },
    {
      "providerId": "fal.api",
      "displayName": "fal.ai External API (optional)",
      "kind": "api",
      "kindDetail": "external_api_approved_optional",
      "sourceBucket": "externalApiApprovedOptional",
      "status": "registered_optional",
      "runtimeEvidence": [
        "config/capabilities/adept-ui-v1.0-native.json#providerKinds.externalApiApprovedOptional",
        "studio-api/app/codirector/m29/providers.py"
      ],
      "capabilityIdsBound": [
        "generation.video.queue"
      ],
      "workflowAdapterIds": [],
      "jobHandlerIds": [],
      "licenseSummary": "third_party_api_terms",
      "notes": "Optional approved external API provider; not a generative-audio fill."
    }
  ],
  "workflows": [
    {
      "workflowAdapterId": "ltx.scene",
      "kind": "workflow",
      "supportedProviderKind": "local",
      "engine": "comfyui",
      "runtimeEvidence": "studio-api/app/workflows/registry.py"
    },
    {
      "workflowAdapterId": "ltx.simple_i2v",
      "kind": "workflow",
      "supportedProviderKind": "local",
      "engine": "comfyui",
      "runtimeEvidence": "studio-api/app/workflows/registry.py"
    },
    {
      "workflowAdapterId": "ltx.ingredients_ic_lora",
      "kind": "workflow",
      "supportedProviderKind": "local",
      "engine": "comfyui",
      "runtimeEvidence": "studio-api/app/workflows/registry.py"
    },
    {
      "workflowAdapterId": "wan.first_last_frame",
      "kind": "workflow",
      "supportedProviderKind": "local",
      "engine": "comfyui",
      "runtimeEvidence": "studio-api/app/workflows/registry.py"
    },
    {
      "workflowAdapterId": "lipsync.latentsync",
      "kind": "workflow",
      "supportedProviderKind": "local",
      "engine": "comfyui",
      "runtimeEvidence": "studio-api/app/workflows/registry.py"
    },
    {
      "workflowAdapterId": "image.txt2img",
      "kind": "workflow",
      "supportedProviderKind": "local",
      "engine": "comfyui",
      "runtimeEvidence": "studio-api/app/workflows/registry.py"
    },
    {
      "workflowAdapterId": "image.img2img_edit",
      "kind": "workflow",
      "supportedProviderKind": "local",
      "engine": "comfyui",
      "runtimeEvidence": "studio-api/app/workflows/registry.py"
    },
    {
      "workflowAdapterId": "image.zimage_reference",
      "kind": "workflow",
      "supportedProviderKind": "local",
      "engine": "comfyui",
      "runtimeEvidence": "studio-api/app/workflows/registry.py"
    }
  ],
  "processors": [
    {
      "processorId": "ffmpeg",
      "kind": "processor",
      "registryStatus": "missing_from_providerKinds.deterministicProcessor",
      "runtimeEvidence": [
        "studio-api/app/adapters/ffmpeg.py",
        "studio-api/app/codirector/m29/providers.py",
        "docs/codirector/M2.9_ACCEPTED_WITH_LIMITATIONS.md"
      ],
      "capabilityRoles": [
        "audio process / loudnorm / cleanup (not generate)"
      ],
      "notes": "Used for CONNECTED audio process paths; NOT declared in baseline providerKinds.deterministicProcessor (empty array). Not a generative fill."
    }
  ],
  "validators": [
    {
      "providerId": "vision.local",
      "displayName": "Local Vision Validator (M2.5)",
      "kind": "validator",
      "kindDetail": "native_local_validator",
      "sourceBucket": "builtInLocal",
      "status": "registered",
      "runtimeEvidence": [
        "config/capabilities/adept-ui-v1.0-native.json#providerKinds.builtInLocal",
        "studio-api/app/codirector/vision/providers/"
      ],
      "capabilityIdsBound": [
        "codirector.vision.validate"
      ],
      "workflowAdapterIds": [],
      "jobHandlerIds": [
        "validate"
      ],
      "licenseSummary": "runtime_environment_local",
      "notes": "M2.5 VisionEngine local validator provider."
    }
  ],
  "missingSlots": [
    {
      "capabilityId": "audio.dialogue.generate",
      "slotKind": "missing_provider",
      "status": "PARTIAL",
      "nativeProvider": [],
      "baselineProviderIds": [],
      "jobHandler": "audio_generate",
      "featureFlag": "STUDIO_FEATURE_AUDIO_PRODUCTION_V1",
      "fillIntent": "fills_missing",
      "notes": "No registered generative provider in providerKinds or capability providerIds. Deferred M2.9 limitation; M2.10.1 priority fill target."
    },
    {
      "capabilityId": "audio.sfx.generate",
      "slotKind": "missing_provider",
      "status": "PARTIAL",
      "nativeProvider": [],
      "baselineProviderIds": [],
      "jobHandler": "audio_generate",
      "featureFlag": "STUDIO_FEATURE_EDITING_PRODUCTION_V1",
      "fillIntent": "fills_missing",
      "notes": "No registered generative provider in providerKinds or capability providerIds. Deferred M2.9 limitation; M2.10.1 priority fill target."
    },
    {
      "capabilityId": "audio.music.generate",
      "slotKind": "missing_provider",
      "status": "PARTIAL",
      "nativeProvider": [],
      "baselineProviderIds": [],
      "jobHandler": "audio_generate",
      "featureFlag": "STUDIO_FEATURE_EDITING_PRODUCTION_V1",
      "fillIntent": "fills_missing",
      "notes": "No registered generative provider in providerKinds or capability providerIds. Deferred M2.9 limitation; M2.10.1 priority fill target."
    }
  ],
  "priorityFillTargets": [
    "audio.dialogue.generate",
    "audio.sfx.generate",
    "audio.music.generate"
  ],
  "capabilityProviderBindings": [
    {
      "capabilityId": "storyboard.generate",
      "providerIds": [
        "comfy.local"
      ],
      "workflowAdapterIds": [
        "image.zimage_reference",
        "image.txt2img"
      ],
      "jobHandlerIds": [
        "storyboard_generate"
      ],
      "baselineStatus": "accepted",
      "bindingKind": "bound",
      "featureFlag": "STUDIO_FEATURE_PRODUCTION_EXECUTIVE_V1"
    },
    {
      "capabilityId": "generation.image.queue",
      "providerIds": [
        "comfy.local"
      ],
      "workflowAdapterIds": [
        "image.txt2img",
        "image.img2img_edit",
        "image.zimage_reference"
      ],
      "jobHandlerIds": [
        "image_generate"
      ],
      "baselineStatus": "accepted",
      "bindingKind": "bound",
      "featureFlag": "STUDIO_FEATURE_PRODUCTION_EXECUTIVE_V1"
    },
    {